pub_date	title	venue	excerpt	citation	url_slug	paper_url
2023-04-03	Central-Smoothing Hypergraph Neural Networks for Predicting Drug–Drug Interactions	IEEE Transactions on Neural Networks and Learning Systems	""	""	""
2022-07-24	SPARSE: a sparse hypergraph neural network for learning multiple types of latent combinations to accurately predict drug-drug interactions	Bioinformatics	""	""	""
2021-01-18	A survey on adverse drug reaction studies: data, tasks and machine learning methods	Briefing in Bioinformatics	""	""	""
2021-02-01	Boosting prior knowledge in streaming variational Bayes	NeuroComputing	""	""	""
2023-03-24	Dynamic transformation of prior knowledge into Bayesian models for data streams	IEEE Transactions on Knowledge and Data Engineering	""	""	""
2020-05-13	Neural poisson factorization	IEEE Access	""	""	""
2019-05-10	How to make a machine learn continuously: a tutorial of the Bayesian approach	Artificial Intelligence and Machine Learning for Multi-Domain Operations	""	""	""
2017-04-23	Keeping priors in streaming bayesian learning	PAKDD	""	""	""
2014-09-22	Reordering dimensions for Radial Visualization of multidimensional data—A Genetic Algorithms approach	CEC	""	""	""